title,reviews
닥터 스트레인지: 대혼돈의 멀티버스 (Doctor Strange in the Multiverse of Madness),"닥터 스트레인지: 대혼돈의 멀티버스
감독
샘 레이미
출연
베네딕트 컴버배치, 엘리자베스 올슨
개봉
2022.05.04. 미국
평점
리뷰보기


 
어제 저녁에 드디어 닥스2를 보고왔다.
개봉 후 스포를 피하려고 부단히 노력했고
닥스2의 평가가 호불호가 조금 있다는 것 까지만 알고 갔다.


결론적으로 나는 다른거 바라지 않았고
오롯이 완다 웅니의 행복만을 바라봤다.
""제발 우리 완다 행복하게 해줘세욧!!!!!!!!!!!!!!""





영화를 감상하기에 앞서 추천하는 시리즈

우선 이 영화를 온전히 이해하려면
닥스2 멀티버스와 관련된 다른 시리즈를 선행 감상을 하는 것이 제일 좋은 방법이다.

굳이 선행 감상이 필요한 것은 아니지만
기왕이면 돈내고 보는 영화, 세계관을 정확히 이해하고 감상하면 을매나 좋게요?





 
마블 시네마틱 영화는 다 보았다는 가정 하에
최소 꼭 봐야하는 시리즈는 <완다비전>

완다비전에서 다루는 서사는 닥스2와 직접 연결되기 때문에
완다비전만큼은 필수로! 꼭! 보고 가는 것을 추천.








조금 더 시간을 낼 수 있다면 <왓이프> 까지이고

추가적으로 보지는 못하더라도
<엑스맨 시리즈>, <판타스틱 포> 에 이런 히어로들이 있구나.. 라는 
정도만 숙지하고 가면 좋을 것 같다.


간혹 저널들을 읽어보면
드라마 <로키>도 추천하는 경우가 있는데
멀티버스라는 개념 외에는 연결고리가 전혀 없으므로
패스해도 무방하다.


특히 닥스2는 완다비전을 시청했는가 안했는가에 따라 
완다 캐릭터에 대한 해석이 완전 달라질 수 있겠다.
(완다를 지키겠다는 피의 연맹)





마블 시네마틱 유니버스에 호러 장르를 녹여내다


샘 레이미는 <스파이더맨> 시리즈로
국내에서도 이미 유명한 감독이다.
마블판에서는 토비 맥과이어 스파이더맨을 '샘스파'라고 부른다.
그런 샘 레이미 감독의 또 다른 주특기는
바로 B급 호러 영화 연출.



 
닥스2에서 샘 레이미의 특기를 살려
특유의 호러 분위기 연출을 아주 영리하게 녹여냈다.

완다비전 이후 스칼렛 위치, 말그대로 마녀로 각성한 완다를 이용해 공포 분위기를 연출했는데
개인적으로 마블 영화에서 공포영화 분위기를 살짝 느껴볼 수 있었던 점이 아주 만족스러웠다.
다른 차원의 닥터 스트레인지 시체에 빙의해 흡사 좀비 닥스를 볼 때는 즐겁기까지 했다.





Are you happy?





 

마블이 멀티버스 세계관을 구축하면서
가장 많이 보여주는 구도가 바로 다른 차원의 나 자신을 만나는 것이다.

드라마 <왓이프> 에서 닥터 스트레인지는
이미 다른 차원의 자기 자신과 대결을 한 적이 있다.

드라마 <로키> 에서 로키는 다른 차원의 로키의 여성 버전인 실비와 만나
사랑이라는 감정을 느끼기도 했다.

영화 <스파이더맨: 노웨이 홈> 에서 피터는 이전 시리즈들의
다른 차원 스파이더맨들과 만나 처음으로 연대감을 느꼈다.



마블 시네마틱 세계관에 멀티버스 개념이 확립되면서
이런 구도가 자주 등장한다.
벌써 지겹다는 사람들도 있지만

사실상 덕후들 입장에서는 이만한 맛있는 떡밥이 따로 없다.
물론 경우에 따라서는 다를 수는 있지만
최애캐와 최애캐의 만남은 큰 포상임이 틀림이 없다.





번외1) 다차원으로 만났던건 아니지만 캡아vs캡아.




 번외2) 디플 시리즈 <문나이트>는 다차원의 경우는 아니지만
다중인격인 마크 스펙터와 스티븐 그랜트의 만남.
역시 마크와 스티븐도 서로가 위안과 버팀목이 되어주는 존재다.




 
다시 닥스2로 돌아와서

<완다비전>에서 갈갈이 찢겨진 채로 분해된 비전을 지켜봐야했던 완다.
일평생 자신이 사랑하고 아끼던 존재를 잃어야만했던 완다는 
보상기전으로 비전과 함께 행복한 가정을 꾸리는 환상을 만들어낸다.

결론적으로 이 환상 또한 허물이 벗겨지며 완다는 스칼렛 위치로 흑화했고
다른 차원에 실제로 존재할 자신의 아들들을 찾기위해 
궁극적으로 그녀의 행복을 찾기위해 다크홀드(흑마법)에 손을 댄다.

그녀의 상실감을 누구보다 잘 이해하고 위로해줄 수 있는건
다른 차원에 존재한 완다의 아이들이 아니라
다름 아닌 바로 자기 자신이었다. 






 반면,
왓이프 때도 그렇고 닥스2에서도 자기 자신을 만나면 싸우기 바쁜 닥터 스트레인지..
뉴욕에 사는 닥터 스티븐 빈센트 스트레인지씨 분발하시길 바랍니다.





 왓이프에서 크리스틴을 향한 스티븐의 사랑을 볼 수 있는데
이번 영화에서도 스티븐이 크리스틴을 얼마나 사랑하는지 알 수 있어서 좋았다.
모든 차원의 크리스틴을 사랑한다니...

영화 속 흑화된 닥스도 결국 크리스틴 때문에 다크홀드에 손을 대고
왓이프 속 닥스도 크리스틴을 살리려고 흑화되고 만다.
(+왓이프 속 흑화 닥스와 영화 속 흑화 닥스는 다른 닥스다)


흑화된 닥터 스트레인지가 우리 유니버스 닥터 스트레인지에게 대뜸 질문을 하는 구절이 있다.
""Are you happy?""
이 대사는 이 영화를 관통하는 핵심 대사가 아닐까.





마무리로 패트릭 스튜어트가 출연한줄 몰라서 등장할 때 깜짝 놀랐고
캡틴 페기 카터와 린치 버전 캡마도 볼 수 있어서 너무 좋았다.

마지막 쿠키영상에 샤를리즈 테론의 합류도 너무 놀랐다. 
내 신이 마블에 합류하다니... (굉굉)
샤를리즈는 신이예요..




 닥터 스트레인지: 대혼돈의 멀티버스 평가

나는 마블을 엄청 좋아하고 깊게 파는 덕후까지는 아니지만
디플 시리즈나 영화가 공개되면 꼭 챙겨보는 정도의 라이트팬이다.
그래서 그런지는 몰라도 개인적으로 보는 내내 아주 즐겁게 감상했다.
화려한 CG와 비주얼, 그리고 그린스크린 앞에서 열연을 펼친 좋은 배우들까지.
게다가 샤를리즈 테론까지 합류하게 되어 기쁘다.





 "
닥터 스트레인지: 대혼돈의 멀티버스 (Doctor Strange in the Multiverse of Madness),"닥터 스트레인지: 대혼돈의 멀티버스
감독
샘 레이미
출연
베네딕트 컴버배치, 엘리자베스 올슨
개봉
2022.05.04. 미국
평점
리뷰보기

 5/4

 애기랑 같이 1편 예습하고 개봉하자마자 보러 갔다. 액션이 화려하고 풍성해서 히어로물에 기대하는 게 많지 않은 나는 졸잼으로 잘 보고 왔다. 근데 집에 와서 왓챠 열어 보니 많은 사람들이 스트레인지가 아니라 스칼렛 위치가 메인/완다 캐릭터 개 같이 멸망/일루미나티 캐릭터들 총알받이로 허무하게 사용/샘 레이미의 다크함이 디즈니의 밝음과 만나면서 전체 분위기가 이도 저도 아님/허접한 스토리 등등에 끝없이 불만을 쏟아내고 있었다, ㅋㅋ;; 

 멀티버스를 여행할 수 있는 능력을 가진 소녀 아메리카 차베즈(소칠 고메즈)는 악마들에게 쫓기다가 닥터 스트레인지(베네딕트 컴버배치)에게 도움을 청한다. 두 사람은 사랑하던 비전을 잃고 흑화해 '내가 두 아이들과 함께 행복하게 살 수 있는 세계'로 가기 위해 아메리카의 능력을 빼앗으려는 스칼렛 위치 완다(엘리자베스 올슨)를 피해 수많은 멀티버스를 여행한다. 

 이번 편에도 레이첼 맥아담스가 나오길래 조금 기대했는데, 영화 시작하자마자 딴 남자랑 결혼해 버려서 안습이었다. 불쌍한 스트레인지. 저렇게 큰 힘을 가졌지만 역시 사랑은.. -_ㅠ 스트레인지가 쏘서러 슈프림이 아니라는 것도 조금 불만이고, 마지막에 웡에게 절을 하는 건 더 별로였다. 나, 나의 닥터 스트레인지는 저런 꼰대력에 굴복하지 않아..!! 닥터스트레인지 1에서는 스트레인지가 쏘서러 슈프림이었던 것 같은데 혹시 이번에 본 2는 내가 모르는 또 다른 세계의 닥터 스트레인지..?! 

 어벤져스에서 모두와 함께 목숨 걸고 싸웠던 완다를 저런 식으로 소비해 버리는 것도 보는 내내 좀 불편했다. 아무리 그래도 캐릭터 이렇게까지 골로 보내 버리는 건 좀 선 넘는 거 아니냐. 아이언맨은 마지막 가시는 길 그렇게 장엄하게 보내 주더니. 

 그리고 이미 그렇게 돌아가기 시작한지 꽤 되긴 했지만, 마블 영화들이 하나의 거대한 세계가 되어 버리면서 점점 신규 유저 진입이 어려워지고 있다는 느낌을 좀 받았다. 일단 나는 어벤져스를 몇 개 봤지만 비전과 스칼렛 위치의 설정에 대해서는 여전히 잘 모르고 있고, 심지어 이번 영화는 디즈니 플러스에서만 볼 수 있는 '완다 비전'을 봐야 전부 다 이해가 되는 스토리 라인이었다고 한다. 요즘 마블 예전 영화들은 대여도 안 되고 무조건 구매해야만 볼 수 있게 돼 있던데, 너무해; 아이언맨 예전엔 왓챠에 있었는데 그 때 볼걸, 까비.

 닥터 스트레인지 간의 음표 전투 씬은 많은 사람들에게 혹평을 받았지만 나는 좋았다. 음표들이 화려하게 팡팡 터지는 것도 좋았고 아름다운 선율과 함께 다음엔 어떤 곡으로 공격할지 기대되는 것도 좋았음.  

 재밌었는데 다음 편이 기대되진 않는다. 오히려 내 머릿속에 듬성듬성 빠진 예전 스토리들이 궁금해져서 찾아볼 것 같다. 하지만 말은 이렇게 해도 다음 편이 나오면 또 보러 가겠지.. ㅋ"
닥터 스트레인지: 대혼돈의 멀티버스 (Doctor Strange in the Multiverse of Madness),"[영화 닥터스트레인지 : 대혼돈의 멀티버스] 감각적인 영상, 호러무비를 더한 마블 코믹스

마블과 DC 영화는 IMAX로 관람해야 몰입감을 더해준다.
허구의 세계를 현실로 착각 시켜주기 위한 선택을 대부분 사람들도 같은 생각 같다.
IMAX 중앙 좌석은 자리가 없어 개봉일이 꽤 지나서 평일에 관람하였는데 역시나 관객 점유율이 높았다. 코로나에 지쳐 둔감해지는 모습은 나도 마찬가지 같다.
오프닝은 닥터스레인지가 멀티버스 시공간을 자유롭게 이동하는 아메리카와 함께 지구가 아닌 우주와 우주의 경계 인커전에서 비샨티의 책을 차지하기 위해 빌런과 격돌한다. 
전날 숙취로 약간 졸린 상태로 컨디션이 나쁜 편이었는데 오프닝에서 찬물에 샤워를 한 것과 같이 정신이 훅 들었다.


베네디트 컴버배치는 다작으로 바쁜 배우다.
분명 미남과는 거리가 먼 외모에도 잘생긴 남자 역을 훌륭하게 소화하는 능력을 갖추었다.
말쑥한 슈트를 차려입고 결혼식장을 찾은 닥터 스트레인지는 웨스트 박사에게 조롱을 당한다.
유머는 영화 후반까지 품격 있게 심각한 상황을 영화적 요소에 맞춰 심심치 않게 집어 넣어 계속 피식피식 웃음이 터져 나왔다.
'행복한가?'라는 반복적인 질문은 마블 페이즈4의 새로운 우주관에서 핵심적인 화두가 된다.


레이첼 맥아담스는 전작에서 상대적으로 중량감이 없었다.
대혼돈의 멀티버스는 매우 중요한 역할을 맡아 비중이 높아졌다.
후속 편을 감안한 캐스팅까지 마블의 계획성에 놀라울 따름이다.
닥터 스트레인지의 의사 동료 크리스틴 팔머는 연민의 관계로 등장하는 그녀의 모습은 로코 여신다운 싱그러움이 여전했다.


괴상망측한 우주 괴물이 멀티버스 이동 능력을 갖춘 아메리카를 집요하게 뒤를 쫒는 이유는 알 수 없다.
우리가 사는 지구 그리고 우리가 존재하는 우주를 벗어난 광범위한 확장 공간 덕분에 빌런의 모습은 상상력의 한계를 뛰어 넘는다.
초반 화려한 CG 액션은 이미 단련되어 웬만한 충격에 무뎌진 관객에게도 스트레스 해소가 가능한 충격적인 장면의 연속이다.  


우주 빌런에게 추격 당하는 아메리카는 나약하고 평범한 멕시코 소녀다.
어머니들이라는 표현을 보면 레즈비언 부부가 입양한 소녀로 추정된다.
마블은 동양과 히스패닉으로 범위를 넓혀 월드와이드 성적을 위한 영리한 선택지를 활용한다.


당연히 닥터스트레인지를 도와 완다가 빌런을 상대로는 전혀 예상하지 못했다.
관람 후기를 보면 디즈니 완다 시리즈를 봐야 이해가 된다는데 그럭저럭 이해할만한 스토리였다.
완다를 맡은 엘리자베스 올슨은 신비한 분위기로 매력이 넘치는 배우임을 이번에도 보여 주었다.


베네딕트 웡은 마블 영화의 감초와 같이 자주 모습을 보여 주지만 사건을 이끌어 나가는 중요한 역할을 맡지 않았다.
닥터 스트레인지에서 만큼은 그의 역할이 중요하다.


멀티버스를 오가는 닥터 스트레인지는 다양한 존재로 실존한다.
흑 마법서 다크 홀드에 정신이 오염된 시니스터 스트레인지는 사악한 모습으로 화면을 압도한다.

다른 시공간 우주에서 뉴욕의 모습은 서로 다르다.
그러나 생명의 원천은 같다는 설정으로 스트레인지의 과거가 동일한 현상은 멀티버스의 큰 오류 같다.

 
닥터 스트레인지와 시니스터 스트레인지의 대결은 암울한 뉴욕의 배경과 다르게 음악으로 대결을 펼친다.
무협소설의 비파, 피리 등의 음공 무기와 같이 살벌한 장면에 아름다운 음표로 대결하는 장면은 재치 넘치는 특수 효과였다.


또 다른 우주의 지구838은 어벤저스를 대신한 일루미나티가 타노스를 물리쳤다.
멀티버스의 과학적 접근이 가능한 문명의 세계로 자비스가 조정하는 로버트 군단이 경호 임무를 맡는다.
일루미나티의 멤버는 엑스맨의 자비에 박사, 캡틴 아메리카를 대신한 캡틴 카터 등 마블 캐릭터를 재미있게 소환한다.


타노스를 물리친 일루미나티는 프리메이슨과 연계되는 결사 단체로 미국을 비롯한 서구를 지배하는 존재로 그 이름을 사용하여 막강 조직을 상징한다.
그러나 좀비를 연상 시키는 완다에게 몰살 당한다.
마블 코믹스도 예전과 다르게 살인 장면을 자극적으로 다뤄 아이들이 보는 착한 영화를 벗어나 매운 맛을 보여주기 시작한다.
공포 영화의 실력자 샘 레이미가 감독을 맡아 자극적인 호러 무비의 색채를 띄고 있어 흥미진진하게 화면에 빠져 들었다.


흑 마법서 다크 홀드의 비법 가운데 드림워킹은 꿈을 오가는 마법이다.
닥터 스트레인지는 이미 사망한 디펜더 스트레인지의 몸에 들어가 완다와 대결한다.
육신은 썩어 문드러졌지만 정신은 닥터 스트레인지로 등장하는 디펜더 스트레인지의 분장은 캐러비안의 해적이 연상되는 과한 분장이 거슬렸다.
샘 레이ㅂ미가 잘하는 이블 데드의 썩은 시체 수준의 분장이 자연스러움을 살렸을텐데 아쉽다.
사용되는 음악도 고전 오케스트라와 함께 다양한 장르의 영화 음악이 사용되어 현대적인 감각을 살렸다.
한스 짐머 특유의 지속적인 음악과 다른 대니 앨프먼이 담당한 음악은 음악 분량을 자제하여 영상에 집중하도록 하였다.


다양한 우주를 다루다 보니 화면의 비쥬얼은 다양하고 상상력을 자극한다.
대부분 암울한 모습이 많아 우리가 살고 있는 지구를 돋보이게 만든다.


완다가 빌런으로 변한 이유는 존재하지 않는, 어쩌면 절실하게 존재하는 두 아들 때문이다.
디즈니 시리즈 완다비전을 못 본 상태에서 두 아들 토미와 빌리가 완다를 빌런으로 만든 이유는 정확하게 모르겠다.
또 다른 우주의 완다가 키우는 토미와 빌리는 유전적인 영향으로 선천적인 초능력을 갖고 있다.
실제 나이보다 10살 가깝게 성장하였기 때문에 하는 행동은 두 살 아기와 같다.
독심술, 삼촌과 같은 스피드, 염력 등을 갖고 있지만 영화에서는 보여주지 않는다.


마블은 동양 사고의 권선징악과 결초보은을 벗어난 세계관을 보여준다.
마지막 결말도 우리가 예상하는 방식을 벗어나 약간은 허무하게 결말을 맺는다.
결과의 원인이 설득력이 부족함에도 화려한 화면, 현란한 마법 드림워킹, 호화로운 다수의 캐릭터 그리고 추후 마블 페이즈4로 가는 길목이 기대하게 만든다.
스톤을 차지하려는 타노스가 어벤저스의 빌러이었다면 이후 확실한 빌런 깡이 등장 전이다.
쿠키로 샤를리즈 테론이 클레아로 모습을 비춘다.
닥터 스트레인지의 여인으로 샤를로즈 테론의 미모라면 충분한 설득력이 있지만 신선한 신인 배우가 맡았으면 하는 아쉬움도 있다.
클레아가 등장하면서 그녀의 삼촌 도르마무도 실체가 드러날 것 같다.
암흑의 우주를 지배하는 도르마무와 닥터스트레인지의 대결에는 가디언즈 오브 갤럭시 멤버들도 등장하리라 기대해 본다.
두 번째 쿠키에 등장하는 피자볼 노점상 주인 부르스 캠벨의 코믹 연기는 크지만 허무한 폭소를 유발한다.
이블 데드를 통한 샘 레이미와의 인연으로 스파이더맨 단역으로 계속 등장하더니 닥터 스트레인지에서 크게 한 판 웃음을 준다. 


  닥터 스트레인지: 대혼돈의 멀티버스
감독
샘 레이미
출연
베네딕트 컴버배치, 엘리자베스 올슨
개봉
2022.05.04. 미국
평점
리뷰보기

 "
닥터 스트레인지: 대혼돈의 멀티버스 (Doctor Strange in the Multiverse of Madness),"영화 리뷰 - 닥터 스트레인지: 대혼돈의 멀티버스



개요 
제      목 : 닥터 스트레인지: 대혼돈의 멀티버스(Doctor Strange in the Multiverse of Madness, 2022)
감      독 : 샘 레이미
개봉 날짜 : 2022년 5월 4일(우리나라 기준)
상영 시간 : 126분
평      점 : 메타크리틱 62점, 로튼 토마토 75%, IMDb 7.6점
총 관객수 : 약 200만명(5월 7일 기준, KOBIS 통계)


닥터 스트레인지: 대혼돈의 멀티버스는 마블 시네마틱 유니버스 페이즈 4의 5번째 영화이자, 닥터 스트레인지 시리즈의 2번째 작품입니다. 주요 내용은 멀티버스와 완다 그리고 아메리카 차베즈라는 새로운 등장 인물이 만들어내는 이야기인데, 영화 공개 전에는 <스파이더맨: 노 웨이 홈>에서 멀티버스를 건드려서 세계간의 경계가 무너지는 현상이 생기고 그것을 스트레인지가 막는다라는 추측이 있었지만 실제 내용은 완전 다른 것이었습니다. 

감독은 샘 레이미가 맡았는데, 공포 영화에 일가견이 있는 감독입니다. 그래서 이번 영화가 호러 영화에 가깝게 만들어 진 것으로 보입니다.


 평가를 살펴보면 마블 영화 치고는 좀 낮은 편입니다. 여러가지 분석이 있는데, 위에서도 언급했지만 히어로 영화이지만 액션 영화가 아니라 호러 영화에 가깝게 제작되었는데, 하필 어린이날 근처에 개봉했고, 상영 등급을 12세로 받아 버리는 바람에 <판의 미로>라는 영화처럼 어린이들에게 트라우마를 남기는 영화가 된 사례가 많은 것 같습니다.


티저 예고편 


높아진 진입 장벽 
닥터 스트레인지: 대혼돈의 멀티버스에 나오는 모든 장면을 이해하려면 정말 많은 작품을 보아야하는데, 대표적으로 <완다비전>, <스파이더맨: 노 웨이 홈>, <닥터 스트레인지가 등장한 모든 영화> 등이 있습니다. 마블 영화 자체가 시리즈물로 나왔고 벌써 4번째 페이즈이다보니 누적된 작품들이 많고 이 작품들이 연결되는 점도 많기 때문에 정말 시리즈를 처음부터 계속 보고 있는 사람이 아니라면 점점 이해하기 힘든 장면들이 많이 생기는 것입니다. 이것이 이제 소위 말하는 마블 영화의 <진입 장벽>이란 것이 됩니다. 


 그런데 이번 작품은 특히나 진입 장벽이 높은 편이데요. 이 진입 장벽에 약간의 문제가 있습니다. 지금까지의 영화들은 마블 영화만 봐도 어느정도 이해가 가는 정도 였는데, 이번 영화는 마블 드라마인 <완다비전>을 필수로 봐야하기 때문입니다.(완다비전을 보지 않았으면 작중 완다의 심리가 전혀 이해가 안될 겁니다.) 그런데 <완다비전>은 디즈니+의 독점작이라 디즈니+를 구독해야만 볼 수 있습니다. 솔직히 드라마까지 다 챙겨볼 정도는 아니고 영화만 챙겨보는 팬들은 어이가 없을 것 같습니다. 앞으로도 계속 이런식으로 나온다면 영화 팬들이 점점 떨어져나가지 않을까 걱정도 되고, 영화를 보기 위해 내가 드라마까지 다 챙겨 봐야 하나? 라는 의문도 생기네요. 


 
총평 
저 역시 이 영화가 호러 장르가 될 것이라곤 전혀 예상하지 못하고 관람했는데요. 그래도 뭐 깜놀하는 장면이 많지 않았고, 기본 적으로 히어로 영화에 호러를 가미한 정도라 그렇게 무섭진 않았네요. 오히려 신선한 느낌이 들어 좋았습니다. 새로 등장한 아메리카 차베즈 캐릭터도 맘에 들고, 배우 캐스팅도 잘한거 같아서 더 만족스럽습니다. 아무튼 개인적으론 정말 재밌게 보긴 했는데, 그래도 이 영화를 보기 전에 먼저 보아야 할 작품들이 많다는 점과 그 작품들이 디즈니+의 독점 작품이라는 점 때문에 높은 점수를 주진 못하겠습니다.

※ 참고로 쿠키 영상은 2개 있는데, 마지막 쿠키는 큰 의미 없습니다. 1개만 보고 나와도 됩니다.

닥터 스트레인지: 대혼돈의 멀티버스
감독
샘 레이미
출연
베네딕트 컴버배치, 엘리자베스 올슨
개봉
2022.05.04. 미국
평점
리뷰보기


영화 가격 정보 

닥터 스트레인지: 대혼돈의 멀티버스는 아직 상영중인 영화라 볼 수 있는 곳이 없습니다.

※ 필자는 영화관에서 관람 했습니다.

 


이 영화를 보기 전에 봐야할 작품들 
[드라마 리뷰] 완다비전(WandaVision, 2021) - 디즈니+의 첫번째 마블 시네마틱 유니...
드라마 리뷰 - 완다비전 개요 제 목 : 완다비전(WandaVision, 2021) 제 작 : 케빈 파이기, 루이스 데스포...
blog.naver.com
[영화 리뷰] 스파이더맨: 노 웨이 홈(Spider-Man: No Way Home, 2021)
영화 리뷰 - 스파이더맨: 노 웨이 홈 개요 제 목 : 스파이더맨: 노 웨이 홈(Spider-Man: No Way Home,...
blog.naver.com
[영화 리뷰] 닥터 스트레인지 - 무료로 다시보기 시리즈 #3 올레tv
영화 리뷰 - 닥터 스트레인지 무료로 다시보기 시리즈 #3 베네딕트 컴버배치가 주연한 마블 영화 닥터 스트...
blog.naver.com"
