title,reviews
니 부모 얼굴이 보고 싶다 (I want to know your parents),"지천명 아이돌 설저씨가 드디어 급기야 지난 토요일에 열린 2017 청룡영화제에서 인기스타상을 손에 쥐었다.
 영화 '우상' 촬영하면서 점점 더 까무잡잡하게 태닝을 하고 있는지 이젠 아예 카레빵맨 컬러가 되어서 청룡영화제 포토월에 등장한 설저씨.




아저씨 머리 금발인 거 이젠 모두가 다 아는데 또 열심히 검은색 스프레이로 덮고 나온 거 보니까 '그게 뭐라고 그렇게 열심히 가리냐ㅋㅋㅋㅋㅋ' 싶어서 참 귀엽고... 그 와중에 머리 해주는 쌤들의 스프레이 실력이 점점 늘어서 대종상 때보다 훨씬 자연스러워진 것도 웃기고 귀엽고 귀엽다. 영평상 때 뒷통수의 얼룩덜룩도 귀엽긴 했다만은.. (객관성상실병에 걸렸읍니다)






얘가 호빵맨 친구 카레빵맨이다.

원래 아조씨는 하얀 식빵맨이었는데.... 카레빵이 되었어.... 이수진 감독님... 아저씨 그만 구워요... 흑흑... 이러다가 연말연시쯤에는 탄빵 되겠어요... 그만 구워요..... 마이 구워따아이가... 흑흑.....



하지만 뭔 빵이든 설저씨는 설저씨인 것 자체로 반갑고 너무 좋아서 TV에 아조씨 모습이 잠시 비치기만 해도 나는 기쁨을 주체하지 못하고 까던 귤을 쥐어뜯으며 꺄약꺄악 비명과 함께 거실을 데굴데굴 굴러다녔다. 영평상 이후로 2주 반만에 보는 건데 어떻게 이렇게 또 반갑고 기쁠 수가 있지? 응?ㅠㅠㅠㅠㅠㅠㅠㅠ



 으아아아아아아ㅠㅠㅠㅠㅠㅠㅠ!!!!!!!!! 인기상에 호명되고도 자기 이름 못 들어서 축하박수만 짝짝짝 치고 있다가 뒤늦게 깨닫고 ""나??""라면서 호다닥 일어나는 거 너무 귀엽고 마음이 간질간질해서 힘이 뻗친 나머지 남은 귤을 다 쥐어뜯어 죽일뻔했다. 주변 시끄러워서 제 타이밍에 못 알아들은 거 너무 씹덕이야 흑흑ㅠㅠㅠㅠ 엉엉 별 게 다 씹덕이야 진짜 흑흑ㅠㅠㅠㅠㅠㅠㅠㅠ



https://youtu.be/N3mHSIJmG2w
동영상
청룡영화제 설경구 압도적인 인기
youtu.be


'이 인기의 비결은 외모다, 연기력이다?'라는 MC봉골레님의 질문에 대답하려고 마이크 마중 나가던 입술이 객석의 ""외모다아아앜!!!!!!!!!!!!"" 샤우팅에 움찔해서 멈추더니 눈으로 팬석에 있는 자기 익룡들 눈치 보는 거 존웃ㅋㅋㅋㅋㅋㅋㅋㅋㅋㅋㅋㅋ


가만 둬도 '외모'라고 답했을 것 같긴 한데 그 와중에 피 토할 기세로 절절하게 외모오오오오!!! 를 부르짖는 자기 팬들 쳐다보느라 멈칫거리는 것도, 빠르게 눈치 본 후 ""외모다아 핳핳핳핳"" 하는 것도 귀여워죽겠다아아아! 엉엉ㅠㅠㅠㅠㅠㅠㅠㅠㅠ


아이고 청룡 보다가 내가 우리집 귤 다 죽이네!!!!!!! 힘으로 발산하지 않으면 참을 수 없는 커여움이다 이거슨!!!!!!!!!!!!! 전... 전봇대를 뽑!!!!!! 갸아아아아아앜!!!!!!!!!!!!!!!!




트로피 받자마자 팬석에 대고 번쩍 들어서 보여주는 것도 너무 귀엽고 스윗터지고, 너무.. 너무다ㅠㅠㅠㅠㅠㅠㅠㅠ





숨.. 숨을 쉬자 진정해..! 으어 반백살 아조씨가 팬 심장폭행 뚜샤뚜샤 으엌




사진출처 @___untit1ed


이 날도 얼마나 무대 위에서 아래에서 자기 팬들 있는 곳에 안뇽안뇽해줬던지, 대포여신들이 찍어온 안뇽짤이 자루 한 가득이더라.


@seol9nine


아저씨 본인이 먼저 손 흔들흔들 안뇽안뇽 하기도 하고, 주변에 있는 관계자나 배우들이 팬들 존재 일깨워(?)줄 때마다 아까 인사했는데 또 손 흔들흔들 해주고. 저렇게 수상자 기념사진 찍으러 무대 올라가서도 또 안뇽안뇽.




사진출처 @BLOSSOM IN SNOW


↑↑자기 익룡들 있는 곳 바라보는 익룡주인의 눈빛 기본값

 
저렇게 상 받고 영화제 잘 마치고 퇴근하던 설저씨는 로비를 한가득 메운 익룡친구들에게 빠빠이를 날리고 꾸벅꾸벅 인사하고 떠나가는가 싶더니 걸음을 돌려 익룡 앞으로 대차게 전진ㅋㅋㅋㅋㅋㅋㅋㅋ 가까이에서 다시 한번 인사해주고 갈 생각이었나본데 최전선에 내밀어져 있던 꽃다발을 못 본 척하지 못하고 거기까지 가서 받아주고, 떨어진 거 주워서 챙겨들고... 관계자가 와서 붙드는 순간까지도 익룡의 주인다운 굽어살피심을 시전했다.



https://www.instagram.com/p/Bb69qCEHhh5/
동영상
씨제스엔터테인먼트•C-JeS Entertainment님의 Instagram 게시물 • 2017 11월 25 ...
좋아요 1,714개, 댓글 35개 - Instagram의 씨제스엔터테인먼트•C-JeS Entertainment(@cjes.tagram)님: ""덕분에 인기스타 #설경구 정말 감사...
www.instagram.com

영화제에서 로비가 설경구 팬들로 꽉 찬 거 실화냐. (설저씨 최고 전성기에도 안 저랬을 거 같은데ㅋㅋㅋㅋㅋㅋㅋㅋ) 구멍 난 마을의 댐이 무너질까봐 밤새 온몸으로 막았다는 동화책 속 소년마냥 경호원들이 저렇게 온몸으로 반백살 아저씨의 소녀팬들이 쏟아져내리지 않도록 처절하게 버티고 있는 거 실화냐ㅋㅋㅋㅋㅋㅋㅋㅋㅋ


하... 역시 이 팬덤은 팬질하는 보람과 재미가 있다ㅋㅋㅋㅋㅋㅋㅋㅋ



저 퇴근길 동영상 촬영과 업로드도 그렇고, 이번에도 씨제스는 나름의 최선과 정성을 다해줬다. 청룡영화제 측이 빡세게 굴었는지 입장권을 30장도 아니고 50장도 아니고, 꼴랑 10장 받은 걸 소듕하게 들고 와서는 기운차게 1인1매 멜림픽(정해진 시간에 메일 들어온 선착순으로 당첨자 정하는 것) 개최를 알리는 걸 보고 엄청 웃었다ㅋㅋㅋㅋㅋㅋㅋㅋㅋ 설저씨 팬들이 더 많이 들어갈 수 있을만큼 표가 넉넉했으면 좋았겠지만, 실무라는 게 어디 그렇게 늘 마음대로 굴러가던가. 왠지 그 10장도 나름 열심히 최대한 뽑아낸 수량일 것 같아서 참 하찮고 귀엽고 짠하고 웃기고 그랬다..ㅋㅋㅋㅋ 
팬들한테나 설저씨가 설탕이고 익룡의 주인이시고 전부지, 직원한테는 배우1 배우2 배우3 뭐 그런 거 아니냐. 그래도 뭐라도 챙겨주려고 티켓도 받아오고, 귀찮을텐데 멜림픽도 열고 해줘서 고마웠다. 앞으로도 울꾸 꾸꾸 잘 부탁드려꾸우ㅠㅠㅠㅠㅠㅠㅋㅋㅋㅋㅋㅋ




어쨌든 그렇게 설저씨 본 반가움과 귀여움에 몸부림을 치고 귤을 다 쥐어뜯어놓으면서 허억허억 거친 숨을 몰아쉬는 열광적인 청룡영화상 시청을 마친 후, 시간이 얼마나 지났을까. 별로 안 지난 것 같은데 설저씨의 동지 쏭언니 인스타그램이 올라왔다는 알람이 떴다.






뭐시여ㅋㅋㅋㅋㅋㅋㅋㅋㅋㅋㅋ 아니 무슨 방금 받은 인기상 트로피가 벌써 집에 가있엌ㅋㅋㅋㅋㅋㅋㅋㅋ 퀵 배달 저리가라네ㅋㅋㅋㅋㅋㅋㅋㅋㅋㅋㅋㅋㅋㅋ

뒷풀이도 뭣도 안하고 저거 손에 쥐고 집으로 날아갔나보다 싶어서 현웃ㅋㅋㅋ 왼쪽부터 청룡영화상 인기스타상, 영평상 남우주연상(불한당), 대종상 남우주연상(불한당) 트로피다. 그 좌우에는 팬들이 선물한 팬북과 향수가 깨알같이 같이 서있는 거 너무 귀여워!!ㅠㅠㅠㅠㅠㅠ

쏭언니 글의 마지막이 손 모아 기도하는 이모티콘인 것도 귀엽고 웃기고 귀엽고ㅋㅋㅋㅋㅋㅋㅋㅋ 팬들한테 항상 정성스럽게 합장(?) 인사하는 설저씨 생각나서 또 웃고ㅋㅋㅋㅋㅋㅋ



행복이 목구멍까지 찬 기분으로 실실 쪼개면서 늦은 잠자리에 들었다. 자기 전엔 갤을 봐줘야 하루의 마무으리지!! 싶어서 따끈따끈한 이불 속에 누워서 설저씨 갤에 들어갔는데...





으아아아악!!!!!!!!!!!!! 워메 주여 아부지!!!!!!! 익룡의 주인!!! 갤의 주인 오셨다!!!!!!!!!!!!!!!!!


영화제 끝나자마자 빛의 속도로 집에 트로피 갖다 놓고 지방 촬영 내려가는 중에 팬들한테 '여러분 힘으로 세상에서 제일 좋은 상 받았다'고 글 써준 거 봐아............... 흑흑............. 세상에서 제일 좋은 상이래... 어쩜 말도 저렇게 예쁘게... 흑흑... 아조씨 사랑해요ㅠㅠㅠㅠㅠㅠㅠㅠㅠㅠㅠㅠㅠㅠㅠㅠㅠㅠㅠ

글구 느낌표 짱 많은거 봐!!! 글에서 기운이 넘친다!!! 음성지원 된다!!!ㅋㅋㅋㅋㅋㅋㅋㅋㅋㅋ 손 모아 기도하는 이모티콘 넣었다가 갤에는 안 먹혀서 또 ????로 글이 끝난 것도 그저 러블리하다 헤헿ㅎㅎㅎㅎㅎㅎ 글구 워딩 아조씨 같은 것도 그 아조씨가 설저씨니까 다 너무 기욥따 흑흑ㅠㅠㅠㅠㅠㅠㅠㅠㅠㅠ 



아아아 너무 행복한 밤이지 뭐예요ㅎㅎㅎㅎㅎ 행복이 팡팡 터지고 있어요ㅎㅎㅎㅎㅎ 역시 설저씨가 최고얌ㅎㅎㅎㅎㅎㅎㅎㅎ  

 



그러고 보니 한 달 전이던 10월 말에 열린 '제1회 서울어워즈' 날도 아조씨를 사진과 영상으로 만날 수 있어서 그저 마냥 행복하고 즐거웠더랬다. 그날 레드카펫에 아저씨는 이런 모습으로 차에서 내렸다.


@프롬아도니스




봐라. 햐....... 인간 느와르. 분위기 쩔어. 심지어 팬이 찍은 게 아닌 기자들이 찍은 사진에서조차 아저씨는 느와르 컷들을 남겼다.



차에서 내리자마자 자기 익룡들 비명소리에 돌아보며 반응하더니 멋지게 저벅저벅 레드카펫에 서서 언론매체의 플래시 세례를 받....



....받다말고 갑자기 몸 90도 틀어서 자기 익룡들에게 안뇽안뇽♡ㅋㅋㅋㅋㅋㅋㅋㅋㅋㅋ




아까 차에서 느와르킹 같은 분위기로 내렸던 건 누구였냐ㅋㅋㅋㅋㅋㅋㅋㅋㅋㅋㅋㅋㅋㅋ 여러분은 지금 인간 느와르 설경구에게 유치원 원장님의 영혼이 주입된 순간을 보고 계십니다 ㅋㅋㅋㅋㅋㅋㅋㅋㅋ




사진출처 @majesty


그리고 2주 후에 열렸던 영평상(한국영화평론가협회상)에서 불한당으로 남우주연상을 수상한 설저씨는 '암약한다'는 새로운 모국어 어휘의 존재를 일깨우며 반백살 으른의 고전美(?)를 떨쳤다.

2000년에 박하사탕으로, 2002년에 오아시스로 수상했던 이래 15년 만에 다시 받아든 영평상 트로피를 저리도 애틋하게 바라보다니... 짠혀...ㅠㅠㅠ

충무로 선생님들, 설저씨가 더 늙기 전에 김 중의 김 잘생김을 만방에 알리는 영화 찍고 상도 많이 받게 해주세요ㅠㅠㅠㅠㅠㅠ 우리 아조씨 잘 좀 부탁드려요. 제발 더는 건강 갈아넣어서 영화 찍지 않도록, 더울 땐 시원하게 추울 땐 따뜻하게 비싼 옷 입고 좋은 집에 사는 캐릭터 좀 시켜주세요ㅠㅠㅠㅠ




https://youtu.be/CRS69xac3kI
동영상
남우주연상 설경구 (불한당) 수상소감 [37회 영평상] 영화평론가협회상 (2017.11.9)
[관련기사] http://www.kbs.co.kr/tt/news/news_view.php?mgz_seq=298743 2017년 11월 9일(목) 오후 프레스센터 20층 국제회의장에서 열린 제37회 ...
youtu.be
http://entertain.naver.com/read?oid=438&aid=0000016999

이 날 수상 직후 가장 먼저 불한당원 팬들에게 감사를 전한 설경구는 ""올 한해 많은 도움을 받으면서 살았던 것 같다. 변성현 감독, 배우들, 스텝들, 관객 분들께 정말 감사드린다. 더불어 '살인자의 기억법'을 연출한 원신연 감독에게도 제가 지금껏 해보지 않았던 캐릭터를 맡겨주셔서, 새로운 도전을 할 수 있게 해주셔서 감사드린다는 말 꼭 전하고 싶다. '불한당' 현장은 걱정과 설렘이 함께했던 현장이었다. 앞으로도 설레면서 현장을 가고 싶고 연기를 하고 싶다. 앞으로 공간이 되고 장소가 되고 시간이 되는 얼굴과 몸으로 계속 열심히 연기하겠다.""며 감격 어린 소감을 밝혔다. 


앞으로 공간이 되고 장소가 되고 시간이 되는 얼굴과 몸으로 계속 열심히 연기하겠습니다.

앞으로 공간이 되고 장소가 되고 시간이 되는 얼굴과 몸으로 계속 열심히 연기하겠습니다

앞으로 얼굴과 몸으로 계속 열심히 연기하겠습니다

앞으로 얼굴과 몸으로 계속 열심히 연기하겠습니다




설저씨가 얼굴과 몸으로 열심히 연기하겠대...!! 드디어 본인 잘생김을 깨달은 거야....!!! 반백살에 리즈가 왔어!!! (나 듣고 싶은대로 듣는다)





사진출처 @majesty


뭐 줍겠다고 허리 숙인 순간인가 이건. 뭐든 간에 일상생활이 이렇게 고혹적이고 섹시할 일인가!!!


설경구에게 책(시나리오) 보내는 모든 충무로 피플 여러분, 그의 현재 인기는 '연기' 때문이 아닙니다. 연기는 25년 전부터 원래 기본옵션이었고, 2017년 지금의 이 난리의 원인은 백퍼 '외모'!!! 외에에에에에모오오오오 덕입니다!!!

각종 영화제에 아저씨가 익룡 몰고 다니는 거 보면서 '히히히힣 설경구 팬들 재밌당' 할 때가 아니야!! 정신 차려! 눈을 떠!! 오픈 니 아이즈!!! 영화라는게 한 달 찍고 다음 달에 개봉하는 게 아니잖아요? 빠른 '설경구 확보'만이 여러분의 차기작에 꽃길을 깔아줄 것입니다. 잘생겼고 돈 많고 섹시 터지는 정치물, 사극 캐릭터 하는 설저씨 좀 보게 해달라고 오늘도 충무로 방향으로 정화수 떠놓고 소원을 빌어봅니다.


잘생겼고 돈 많고 섹시 터지는 캐릭터라서 자신있게 책을 보냈는데 설저씨가 안 한대요? 물러서지마!! 가서 우세요! 일단 설저씨랑 술을 먹고 아저씨 앞에서 울어!! 막 울어!!! 그럼 그 눈물 많은 아저씨가 아마... 할 겁니다... (10kg 이상 빼거나 찌우는 개고생 시나리오 들고가서 울면 주길꺼다...... 가만두지 않을끄야....... 나도 울 거다, 아주 그냥 머리 풀고 오오오오오열을 할 거야...)




청룡영화제에서 '불한당' 때 같이 했던 진선규 배우가 '범죄도시'로 남우조연상 호명되고 오열하니까 옆에서 금세 울컥해서 (｡•́︿•̀｡) 이 상태가 되었다. 아조씨는 알면 알수록 눈물 싱크로율이 높고 잘 우는 눈물맨이다.




이제 올해 설저씨를 볼 수 있는 공식석상은 청룡영화제로 끝난 것 같다. 해가 바뀌고 새 영화 '니 부모 얼굴이 보고 싶다'의 무대인사 때나 되어야 볼 수 있으려나... 흑흑...ㅠㅠㅠㅠㅠㅠ


흑흑..... 설저씨는 좋겠다....... 거울 보면 설경구 볼 수 있어서ㅠㅠㅠㅠㅠㅠ 시상식 없어도 무대인사 없어도 아무 때나 설경구 볼 수 있어서 좋겠다ㅠㅠㅠㅠㅠㅠ 아무 때나 자기 사진 찍으면 그게 설경구 미공개 뉴짤이라 좋겠다ㅠㅠㅠㅠㅠㅠㅠㅠㅠ



저는 아조씨의 새 소식이 뜰 때 말고는 아마.... 이러고↓ 있을 거에요.


헤헤.... 이미 갖고있는 사진들과 꾸꾸친구들이 만들어주는 이~쁜 짤과 현웃 터지는 과거사진들로 연명해보겠어요...


허잇! 할 수 있다!! 난 할 수 있다!!! 카레빵맨은 일(촤령)을 하고!! 나는 일도 하고 덕질도 해야한다!! 24시간을 48시간 같이 쓰자!!! 따하이!!!!!!!!"
니 부모 얼굴이 보고 싶다 (I want to know your parents),"전에 학교에서 아주 재미있게 본 책인데 영화로 된다니 기쁠 따름 이네요. 그런데 오달수 나와서.. 보기가 좀 구렇네요.. 안그래도 여학생이라서..
보기가 좀 그래요.. 어떻게 좀 안될까요..ㅇㅅㅇ..흙흙
  아 200자 내외 짜증난다고요오오오오오ㅗ짜증나아앙ㅇ아아아아아ㅏㅏ아앙아아ㅏ아아아ㅏㅏㅏㅏㅏㅏㅏㅏㅏㅏㅏㅏㅏㅏㅏㅏㅏㅏㅏㅏ아아ㅏㅏㅏㅏㅏㅏㅏㅏㅏㅏㅏㅏㅏㅏㅏㅏㅏㅏㅏㅏㅏㅏㅏㅏㅏㅏㅏㅏㅏㅏㅏㅏㅏㅏㅏㅏㅏㅏㅏㅏㅏㅏㅏㅏㅏㅏㅏㅏㅏㅏㅏㅏㅏㅏㅏㅏㅏㅏㅏ"
니 부모 얼굴이 보고 싶다 (I want to know your parents),"<니 부모 얼굴이 보고 싶다>
설경구-오달수-천우희-고창석-문소리-강신일-김홍파
5월 29일(월) 크랭크인, 최강의 명품 배우 라인업!










영화 <니 부모 얼굴이 보고 싶다>가 설경구, 오달수, 천우희, 고창석, 문소리, 강신일, 김홍파까지 명품 연기파 배우들의 캐스팅을 확정하며 지난 5월 29일(월) 전격 크랭크인했다. [감독: 김지훈 | 출연: 설경구, 오달수, 천우희, 고창석, 문소리, 강신일, 김홍파 | 제공: 이십세기폭스 | 제작: (주)더타워픽쳐스, 폭스 인터내셔널 프로덕션(코리아) | 공동제작: (주)수현재엔터테인먼트, (주)리버픽쳐스 | 배급: 이십세기폭스코리아㈜]
<타워>, <화려한 휴가> 김지훈 감독 연출!
설경구-오달수-천우희-고창석-문소리-강신일-김홍파, 충무로 명품 배우들의 의기투합!
성유빈-유재상-정유안-박진우-정택현-노정의, 떠오르는 아역 배우들의 발견!
이십세기폭스가 선택한 2018년 한국영화 기대작!


영화 <타워>, <화려한 휴가> 등 굵직한 소재와 탁월한 연출력으로 관객들의 폭넓은 사랑을 받아 온 김지훈 감독이 영화 <니 부모 얼굴이 보고 싶다>로 돌아왔다. 이십세기폭스가 선택한 여섯 번째 한국영화 <니 부모 얼굴이 보고 싶다>는 일본의 동명 희곡을 원작으로 설경구, 오달수, 천우희, 고창석, 문소리, 강신일, 김홍파까지 충무로 연기파 배우들이 함께해 강렬한 이야기를 선보일 예정이다.
  
영화 <니 부모 얼굴이 보고 싶다>는 명문 국제중학교의 한 남학생이 호수에 빠져 의식을 잃은 채 발견되자 같은 반 학생들의 부모들이 학교로 소집되면서 벌어지는 이야기를 그리고 있다. 학생들의 부모 역은 설경구, 오달수, 고창석, 문소리, 김홍파가 맡았으며 교장 역에는 강신일, 담임 교사 역은 천우희가 맡아 열연을 펼칠 예정이다. 부모들 역과 함께 중요한 비중을 차지할 학생들로는 성인 못지 않은 연기력을 인정 받은 성유빈, 유재상, 정유안, 박진우, 정택현, 노정의가 캐스팅되어 기대감을 모으고 있다.

<화려한 휴가>, <타워> 등에서 드라마틱한 휴머니즘을 선보인 김지훈 감독의 연출력과 충무로 최고의 명품 연기파 배우들의 탄탄한 연기력으로 완성될 영화 <니 부모 얼굴이 보고 싶다>는 오는 2018년 개봉할 예정이다. 
 "
니 부모 얼굴이 보고 싶다 (I want to know your parents)," 

뉴스에서, 혹은 학창시절에 흔히 접할 수 있었던 학교폭력에 대한 이야기를 영화 <니 부모 얼굴이 보고 싶다>로 제작했다는 영화 정보는 그 주제의 심각성 때문에 사실 볼까 말까 고민을 하게 만들었다.



동영상이 첨부되었습니다. 원본보기
영화 니 부모 얼굴이 보고 싶다 정보 & 예고편



하지만, 설경구, 천우희, 문소리, 오달수, 고창석, 강신일, 김홍파 같은 명배우들을 대거 캐스팅해서 우리 사회에 뿌리 뽑기 어려운 문제를 영화화했다는 것에 대해서는 호기심을 가지기에도 충분했다. 그리고, 주제의 특성상 영화의 내용은 결국 권선징악이 아닐까 하는 기대감도 내심 있었다.




 
 

막상 영화를 감상하고 보니 <니 부모 얼굴이 보고 싶다>는 학교폭력에 대한 주제와 메시지를 기반으로 하여 가해자 학생 부모의 관점에서 그들의 자식에 대한 입장과 부모의 역할에 대한 이야기를 소름끼치게 전개하는 영화였다.



 

작년에 <싱크홀>을 만들었던 김지훈 감독의 영화적 색채가 1년 만에 달라지니 다시 메가폰을 잡기 시작한 김지훈 감독의 앞으로의 행보가 궁금해졌다. 김지훈 감독은 이 영화를 만들기 위해 5년이나 준비를 했다고 한다.






현재 영화관 내 팝콘 취식 가능, 5월 2일부터는 좌석간 띄어앉기 해제를 앞두고 코시국으로 잃었던 관객들을 극장으로 불러 모으려고 하는지 많은 한국영화들이 쏟아지듯 개봉하고 있는데, 영화 <니 부모 얼굴이 보고 싶다>는 그중에서도 나름 두각을 나타낸 작품이라고 생각한다.




 


재미있는 사실 하나는 영화가 시작되고 얼마 후까지는 부스럭거리며 팝콘을 먹는 소리가 여기저기서 들렸는데, 영화에 점차 긴장감이 흐르자 팝콘 먹는 소리가 어느샌가 모조리 사라졌다는 것이다. 그만큼 이 영화의 몰입감은 정말 높았다. 그런 몰입감은 설경구, 천우희, 문소리, 오달수를 비롯한 연기파 배우들의 사실적인 연기 때문이었을 것이다.




 

영화 속에는 작당모의를 한 가해자 부모들 사이의 중상모략과 배신, 새로운 학생의 등장, 조용한 성격으로 보였던 담임 선생님의 행동 변화, 뜻밖의 증거물 발견 등, 관객의 집중력과 호기심을 높일 수 있는 장치들이 끊임 없이 등장했다. 




 

영화를 보면서 나의 학창시절을 돌아보며 감정이입을 하기도 했고, 맹목적으로 악한 자들에게 엄벌을 내려주고 싶은 조바심도 느끼게 됐다. 소년법 폐지, 촉법 소년 연령 하향 찬성은 물론이다.



 
 

극중에서 피해자, 가해자 학생들은 전국 1% 실력의 학생들만 들어갈 수 있는 한음 국제중학교에 다니고 있다. 공부만 잘 하면 뭐든 괜찮다고 교육 받는 아이들. 집안이 아무리 좋다고 해도 그런 인성교육 결핍 학생들이 공부를 잘 해 좋은 대학에 간들 사회에 나오면 결국 나쁜 뉴스에서 접하게 되는 그런 부류의 상류층이 되지 않을까?






 

하지만, 그들의 부모는 입장이 달랐다. 자기 자식은 수단과 방법을 가리지 않고 무조건 보호해야 했던 것이다.

그런데, 충격은 거기서 끝나지 않았다. 가해자 학생들은 자기들이 잘못을 저질렀다는 것도 깨닫지 못한다는 것이다. 그런 인성 결여는 대체 어디서부터 시작됐을까? 영화를 보는 내내 가슴이 아팠고, 답답하기만 했다.




 

아마도 김지훈 감독이 내심 촉법 소년 보호 폐지 같은 여론을 조성하려고 이 영화를 만든 건 아닌지 하는 생각도 들었는데, 얼마 전 공개되었던 김혜수 주연의 넷플릭스 드라마 <소년 심판>도 비슷한 주제를 가지고 있다.




 

원래 <니 부모 얼굴이 보고 싶다>는 일본의 극작가이자 고등학교 교사인 하타사와 세이고 씨가 일본 후쿠오카에서 일어났던 중학생 자살 사건을 바탕으로 만든 연극 각본이며, 2012년 1월 현대일본희곡 낭독공연에서 상연되었고, 그 후 소설화된 희곡이 출간되었다고 한다.




 

원작에서는 하루의 시간 동안 가해자들 부모 사이에 일어난 일을 무대에 올렸지만, 김지훈 감독은 <니 부모 얼굴이 보고 싶다>를 영화화하면서 등장인물과 사건의 공간을 확장시켜 피해자와 가해자 학생들의 이야기를 영화적으로 재해석하는데 주력했다고 한다.






 

처음에는 별 생각 없었던 <니 부모 얼굴이 보고 싶다>라는 제목이 사뭇 의미심장하게 다가온다. 문제아들, 그러니까 가해자들이 피해자 학생 한 명을 그토록 괴롭혀 자살로 몰아넣을 정도로 인간성이 파괴된 책임을 져야 하는 본인들을 낳고 기른 부모들, 그들의 추악한 얼굴이 궁금하긴 하다. 이것으로 영화 니 부모 얼굴이 보고 싶다 정보 & 노스포 리뷰를 마쳐야겠다. 명배우들의 연기가 돋보이는, 끝까지 긴장감을 놓을 수 없는, 반전이 있는 영화다.



 
  니 부모 얼굴이 보고 싶다
감독
김지훈
출연
설경구
개봉
2022.04.27. 대한민국
평점
리뷰보기


 "
니 부모 얼굴이 보고 싶다 (I want to know your parents),"니 부모 얼굴이 보고 싶다
감독
김지훈
출연
설경구
개봉
2022.04.27. 대한민국
평점
리뷰보기

으아 정말 보는내내 제 뜨건 정의에 주먹이 참 많이도 참았습돠 

시지비연수역점 늦게 입장힐때 혼자여서 저홀로인줄 큰소리도 반응하면서 몰입했는데 

아불싸 끝나고나니 한연인들이 계셨나봐요 지송요ㅠ

정말 악마를 만드는건 정말 부모이고 그애들이 자라서 나라 팔아먹는 기득권되는 시스템이지요ㅠ

엔딩반전에 또 한번 아이구야 ㅇㅇㅇ"
